{
	"type" : "object" ,
	"required" : true ,
	"$schema" : "http://json-schema.org/draft-03/schema" ,
	"properties" : {
		"alerts" : {
			"type" : "array" ,
			"required" : false ,
			"items" : 
				{
					"type" : "object" ,
					"properties" : {
						"id" : {
							"type" : "string" ,
							"required" : false
						} ,
						"type" : {
							"type" : "string" ,
							"required" : false
						} ,
						"started_at" : {
							"type" : "string" ,
							"required" : false
						} ,
						"user" : {
							"type" : "object" ,
							"required" : false
						} ,
						"address" : {
							"type" : "string" ,
							"required" : false
						}
					}
				}
			
		} ,
		"limit" : {
			"type" : "number" ,
			"required" : false
		} ,
		"offset" : {
			"type" : "number" ,
			"required" : false
		} ,
		"total" : {
			"type" : "number" ,
			"required" : false
		}
	}
}